tourism,2663250,12,신창풍차해안도로,제주특별자치도 제주시 한경면 한경해안로 485,,39,A01,A0101,A01010500,제주특별자치도 제주시 한경면 한경해안로 485,,39,A01,A0101,A01010500,Type3,20200711005006,http://tong.visitkorea.or.kr/cms/resource/24/3354424_image2_1.jpg,http://tong.visitkorea.or.kr/cms/resource/24/3354424_image3_1.jpg,"<a href=""https://www.visitjeju.net/u/5aF"" target=""_blank"" title=""새창: 비짓제주 홈페이지로 이동"">https://www.visitjeju.net/</a>",50,110,NA,NA05,NA050100,126.1721349880,33.3431254722,6,20251027142526,"제주도 서쪽 끝을 따라 연결된 신창 풍차 해안도로는 해상풍력단지가 조성되어 있어 해안도로를 따라 줄지어 서 있는 풍차를 만날 수 있다. 구불구불 해안선을 따라 보이는 하얀 풍차와 에메랄드빛 바다는 우리에게 상쾌한 가을 풍경을 보여준다. 여기에 저 멀리 보이는 차귀도까지 푸른 바다 위 다양한 볼거리가 펼쳐져 있다. 특히 신창 해안도로는 아름다운 일몰로도 손꼽히는 장소이기에 사진을 찍고 일몰을 감상하는 것도 좋다. 또한 해안도로를 달리다 보면 생태체험장이라는 이름의 산책코스를 발견할 수 있다. 이곳에는 자바리상과 원담체험장, 휴게 공간이 마련되어 있어 다양한 풍경으로 사진을 찍는 것이 가능하다. 산책코스 중간에 위치한 전망대는 전체적으로 한산한 편이니, 신창 해안도로를 걸으며 가볍게 사진을 남긴 후 전망대로 향해보자.",4,,,신창풍차해안도로,63002,Type3,20200711005006,http://tong.visitkorea.or.kr/cms/resource/24/3354424_image2_1.jpg,http://tong.visitkorea.or.kr/cms/resource/24/3354424_image3_1.jpg,50,110,NA,NA05,NA050100,126.1721349880,33.3431254722,6,20251027142526,4,,63002,,,,,,,,,,,,,,,,,,,,,,,,,,,success,2026-07-13T03:31:23.614656+00:00,,,0,0,0,제주관광정보센터 064-740-6000,,,,,,,가능,,,,,,,,,,,,,연중무휴,,,,,,,,,,,,,,,,상시 개방,,
tourism,635701,12,신풍 신천 바다목장,제주특별자치도 서귀포시 성산읍 일주동로 5417,,,,,,제주특별자치도 서귀포시 성산읍 일주동로 5417,,,,,,Type3,20081010203404,https://tong.visitkorea.or.kr/cms/resource/48/3401548_image2_1.jpg,https://tong.visitkorea.or.kr/cms/resource/48/3401548_image3_1.jpg,,50,130,NA,NA02,NA020800,126.8637960644,33.3559713485,6,20260624105810,"신풍 신천 바다목장은 제주올레 3코스가 지나는 곳으로, 너른 초지와 탁 트인 바다 풍경이 어우러진 명소이다. 과거에는 지역 주민들이 소유하며 말과 소 등의 가축을 방목하던 목장이었으나, 현재는 목장으로서의 기능을 상실한 상태이다. 이곳은 1980년대부터 감귤껍질을 건조하기 위해 넓은 부지에 펼쳐 놓으면서 색다른 풍경을 만들어 냈다. 특히 주황빛 감귤껍질이 초지 위를 가득 채운 모습이 장관을 이루며 많은 관광객의 발길을 끌었다. 현재는 넓게 펼쳐진 초원과 시원한 바다 경관을 감상할 수 있는 곳으로, 제주올레를 걷는 여행객들에게 사랑받는 구간이다.",,,,신풍 신천 바다목장,63636,Type3,20081010203404,https://tong.visitkorea.or.kr/cms/resource/48/3401548_image2_1.jpg,https://tong.visitkorea.or.kr/cms/resource/48/3401548_image3_1.jpg,50,130,NA,NA02,NA020800,126.8637960644,33.3559713485,6,20260624105810,,,63636,,,,,,,,,,,,,,,,,,,,,,,,,,,success,2026-07-13T03:31:23.768466+00:00,,,0,0,0,제주 관광정보센터 064-740-6000,,,,,,,불가능,,,,,,,,,,,,,연중무휴,,,,,,,,,,,,,,,,상시 개방,,
tourism,2742307,12,싱계물공원,제주특별자치도 제주시 한경면 신창리 1322-1,,,,,,제주특별자치도 제주시 한경면 신창리 1322-1,,,,,,Type1,20210909231622,https://tong.visitkorea.or.kr/cms/resource/70/4070570_image2_1.jpg,https://tong.visitkorea.or.kr/cms/resource/70/4070570_image3_1.jpg,https://www.visitjeju.net/kr,50,110,NA,NA04,NA040500,126.1738937595,33.3434173465,6,20260605084251,"제주시의 숨은 비경 중 하나로 선정되기도 했던 싱계물공원은 신창-풍차 해안이라는 이름으로 더 유명한 곳으로 주변의 풍력발전기들과 함께 이국적인 풍경을 보여준다. 싱게물(싱계물)은 제주 사투리로 ‘새로 발견한 갯물’이라는 의미이며 갯물이라는 것은 용천수를 의미한다. 싱계물공원에는 예전에 목욕탕으로 쓰이던 곳이 있는데, 돌담으로 남탕·여탕이 구분되어 있으며, 용천수라 맑고 깨끗하며 시원하다. 싱계물공원에는 등대까지 직접 걸어갈 수 있도록 바다 위로 다리가 설치되어 있다. 바람과 파도에 살짝 흔들거리기도 하는 다리를 건너면 마치 바다 위를 걷는 것만 같은 이색적인 느낌을 받을 수 있다. 바다에 떠 있는 느낌의 사진이나 근방의 억새를 배경으로 촬영을 많이 하며 최근에는 셀프웨딩 명소로 주목받고 있다. 싱계물공원의 최고의 아름다운 순간은 노을이 질 때다. 신창-용수 해안도로로 이어지며 바다와 풍차가 어우러진 이곳에서는 멀리 보이는 차귀도, 수월봉과 함께 떨어지는 낙조가 아름다운 풍경을 선사한다.",,,,싱계물공원,63002,Type1,20210909231622,https://tong.visitkorea.or.kr/cms/resource/70/4070570_image2_1.jpg,https://tong.visitkorea.or.kr/cms/resource/70/4070570_image3_1.jpg,50,110,NA,NA04,NA040500,126.1738937595,33.3434173465,6,20260605084251,,,63002,,,,,,,,,,,,,,,,,,,,,,,,,,,success,2026-07-13T03:31:23.899675+00:00,,,0,0,0,신창리사무소 064-773-1939,,,,,,,가능,,,,,,,,,,,,,연중무휴,,,,,,,,,,,,,,,,상시 개방,,
tourism,129620,12,쌍용굴(한림공원),제주특별자치도 제주시 한림읍 한림로 300,,,,,,제주특별자치도 제주시 한림읍 한림로 300,,,,,,Type3,20070713090000,https://tong.visitkorea.or.kr/cms/resource/47/3481247_image2_1.jpg,https://tong.visitkorea.or.kr/cms/resource/47/3481247_image3_1.jpg,http://www.hallimpark.co.kr,50,110,NA,NA03,NA030100,126.241825331312,33.3878715738572,6,20260309093631,"쌍용굴(쌍룡굴)은 황금굴, 소천굴, 만장굴과 더불어 제주도의 대표적인 용암동굴이다. 동굴의 길이는 약 400m, 너비 6m, 높이는 3m 정도의 규모이며, 250만 년 전 한라산 일대의 화산이 폭발하면서 협재굴과 함께 생성되었다. 용암동굴이자 석회동굴의 특징이 복합된 2차원적인 동굴이라는 점이 특이하며, 그 일대가 모래와 조개껍질이 섞여 있는 패사층으로 되어 있다. 
쌍용굴은 좌우 양쪽으로 나뉘어 있으며 마치 용 두 마리가 굴 내부에 있다가 밖으로 빠져나간 듯한 모양을 하고 있다 해서 쌍용굴이라고 이름이 지어졌다. 쌍용굴의 제2입구와 협재굴의 끝부분이 인접해 있어 두 동굴은 원래 하나였다가 내부 함몰로 인해 나뉜 것으로 추정되고 있다. 협재굴과 마찬가지로 천연기념물로 지정되어 있다. 
동굴 내부에는 석회동굴의 특징인 석순과 종유석이 곳곳에 기둥처럼 즐비해 있어 신비한 광경을 연출한다. 동굴 벽면에는 석회분이 덮여있어 마치 하나의 거대한 벽화가 새겨져 있는 듯 웅장한 모습을 보인다. 동굴 내부의 온도는 연중 내내 17~18℃를 유지하여 한여름의 이색적인 피서지로 주목을 받고 있고, 한겨울에는 따뜻한 온도로 추위를 피할 수 있어 사계절 사람이 찾는 관광명소이다.",,,,쌍용굴(한림공원),63011,Type3,20070713090000,https://tong.visitkorea.or.kr/cms/resource/47/3481247_image2_1.jpg,https://tong.visitkorea.or.kr/cms/resource/47/3481247_image3_1.jpg,50,110,NA,NA03,NA030100,126.241825331312,33.3878715738572,6,20260309093631,,,63011,,,,,,,,,,,,,,,,,,,,,,,,,,,success,2026-07-13T03:31:30.939472+00:00,,,0,0,0,064-796-0001~4,,,,,,,가능,,,,,,,,,,,,,연중무휴,,,,,,,,,,,,,,,,[2월~5월]09:00~17:00[6월~8월]09:00~17:30[9월~10월]09:00~17:00[11월~1월]09:00~16:30※ 계절별 일몰시간에 따라 변동 가능,,
tourism,2740133,12,아끈다랑쉬 오름,제주특별자치도 제주시 구좌읍 세화리 2593,,39,A01,A0101,A01010400,제주특별자치도 제주시 구좌읍 세화리 2593,,39,A01,A0101,A01010400,Type3,20210906221048,http://tong.visitkorea.or.kr/cms/resource/32/3528332_image2_1.jpg,http://tong.visitkorea.or.kr/cms/resource/32/3528332_image3_1.jpg,"<a href=""https://www.visitjeju.net/kr/detail/view?contentsid=CONT_000000000500406"" target=""_blank"" title=""새창 : 제주시 문화관광 홈페이지로 이동"">https://www.visitjeju.net</a>",50,110,NA,NA01,NA010100,126.8302942866,33.4754212946,6,20250828093600,"제주 동쪽에서 오름의 여왕이라 불리는 ‘다랑쉬오름’ 바로 맞은편에 자리하고 있다. 다랑쉬오름처럼 낮고 자그마한 원형 분화구를 이루고 있으며, 다랑쉬오름과 비슷한 모양을 띠고 있어 아끈다랑쉬라고 부른다. ‘아끈’이란 버금가는 것, 둘째 것이라는 뜻의 제주 방언이다. 아끈다랑쉬 오름은 가볍게 산책하듯이 오를 수 있어 어린이를 동반해도 좋다. 서사면으로 난 작은 길을 따라 10분 정도면 쉽게 오를 수 있고 억새의 물결이 이루는 가을에는 아름다운 풍경을 감상할 수 있다. 키 높이의 억새가 가득 차 있고, 특히 일출 무렵에는 바람에 따라 흔들리는 억새의 파도와 낮에는 햇빛을 받아 반짝이는 은빛 억새가 아름다운 경관을 연출한다. 또한 하얀 억새꽃들이 떨어진 겨울 억새밭은 또 다른 느낌으로 다가온다. 특히 바람이 많이 부는 날에 아끈다랑쉬를 찾으면 흔들리는 억새가 만들어낸 겨울 감성을 느낄 수 있다.",4,,,아끈다랑쉬 오름,63352,Type3,20210906221048,http://tong.visitkorea.or.kr/cms/resource/32/3528332_image2_1.jpg,http://tong.visitkorea.or.kr/cms/resource/32/3528332_image3_1.jpg,50,110,NA,NA01,NA010100,126.8302942866,33.4754212946,6,20250828093600,4,,63352,,,,,,,,,,,,,,,,,,,,,,,,,,,success,2026-07-13T03:31:31.356193+00:00,,,0,0,0,제주관광정보센터 064-740-6000,,,,,,,가능,,,,,,,,,,,,,연중무휴,,,,,,,,,,,,,,,,※ 일부 통제될 수 있으므로 방문 시 전화문의 요망,,
tourism,4061120,12,아라동 치유의 숲,제주특별자치도 제주시 아라일동 산31-8,,,,,,제주특별자치도 제주시 아라일동 산31-8,,,,,,Type1,20260428165139,https://tong.visitkorea.or.kr/cms/resource/87/4061087_image2_1.jpg,https://tong.visitkorea.or.kr/cms/resource/87/4061087_image3_1.jpg,,50,110,NA,NA01,NA010200,126.555575,33.443987,,20260429134631,"아라동 치유의 숲은 제주대학교에서 관음사로 가는 길목에 위치해 있다. 또한 아라동 문화역사 탐방로 2코스의 일부이며 소산오름 자락에서 마주할 수 있는 곳이다. 산림욕을 하며 피톤치드를 마실 수도 있고, 조용히 걷기도 좋다. 특히 건강에 좋은 맨발 걷기를 하는 사람도 많다. 이곳에서는 흡연, 야영, 취사가 불가하다.",,,,아라동 치유의 숲,690121,Type1,20260428165139,https://tong.visitkorea.or.kr/cms/resource/87/4061087_image2_1.jpg,https://tong.visitkorea.or.kr/cms/resource/87/4061087_image3_1.jpg,50,110,NA,NA01,NA010200,126.555575,33.443987,,20260429134631,,,690121,,,,,,,,,,,,,,,,,,,,,,,전 연령,,,,success,2026-07-13T03:31:32.182280+00:00,,,0,0,0,제주관광정보센터 064-740-6000,,,,,,,가능,,,,,,,,,,,,,연중무휴,,,,,,,,,,,,,,,,상시 개방,,
tourism,1351320,12,아부오름,제주특별자치도 제주시 구좌읍 송당리,산164-1,39,A01,A0101,A01010400,제주특별자치도 제주시 구좌읍 송당리,산164-1,39,A01,A0101,A01010400,Type1,20110805004638,http://tong.visitkorea.or.kr/cms/resource/27/3011827_image2_1.jpg,http://tong.visitkorea.or.kr/cms/resource/27/3011827_image3_1.jpg,"<a href=""https://www.visitjeju.net/kr/detail/view?contentsid=CONT_000000000500407"" target=""_blank"" title=""새창 : 제주 문화관광 사이트로 이동"">http://www.visitjeju.net/</a>",50,110,NA,NA01,NA010100,126.7776133886,33.4473291064,6,20250513171547,"아부오름은 일찍부터 아보름이라 불렸고 송당마을과 당오름 남쪽에 있어서 앞오름이라 하여 이것을 한자로 빌어 표기한 것이 전악(前岳)이다. 또한 산 모양이 움푹 파여있어 마치 가정에서 어른이 믿음직하게 앉아있는 모습과 같다하여 아부오름(亞父岳)이라고도 한다. 어렵지 않게 오름 둘레까지 오를 수 있고 제주오름의 모습을 가깝게 느낄 수 있어 최근 각광 받고 있다. 오름 정상에 함지박과 같은 둥그런 굼부리가 파여있다. 특히 굼부리 안 원형 삼나무숲의 특징적인 모습이 주목 받고 있다. 오름 대부분은 풀밭으로 이루어져 있는데, 인공으로 심은 삼나무가 있고 그 사이로 상수리나무, 보리수나무 등이 있다. 풀밭에는 송양지꽃, 풀솜나물, 향유, 쥐손이풀, 청미래덩굴, 찔레 등이 여기저기 서식한다. 아부오름 주변에는 새미오름, 민오름, 백악이오름, 문석이오름 등의 오름이 둘러싸고 있다.",4,,,아부오름,63355,Type1,20110805004638,http://tong.visitkorea.or.kr/cms/resource/27/3011827_image2_1.jpg,http://tong.visitkorea.or.kr/cms/resource/27/3011827_image3_1.jpg,50,110,NA,NA01,NA010100,126.7776133886,33.4473291064,6,20250513171547,4,,63355,,,,,,,,,,,,불가,,,,없음,,,,,,,,,,,success,2026-07-13T03:31:32.299728+00:00,,,0,0,0,제주시 관광정보센터 064-740-6000,,,,,,,가능,,,,,,,,,,,,,연중무휴,,,,,,,,,,,,,,,,※ 일부 출입이 통제될 수 있으므로 방문 시 전화문의 요망,,
tourism,126440,12,안덕계곡,제주특별자치도 서귀포시 안덕면 감산리,1946,39,A01,A0101,A01010900,제주특별자치도 서귀포시 안덕면 감산리,1946,39,A01,A0101,A01010900,Type1,20030925090000,http://tong.visitkorea.or.kr/cms/resource/10/3023810_image2_1.jpg,http://tong.visitkorea.or.kr/cms/resource/10/3023810_image3_1.jpg,"<a href=""https://www.visitjeju.net/kr/detail/view?contentsid=CONT_000000000500410""target=""_blank"" title=""새창: 비짓제주 홈페이지로 이동"">https://www.visitjeju.net/kr/</a>",50,130,NA,NA01,NA010400,126.3529100773,33.2573294533,6,20250512172029,"안덕계곡은 서귀포 안덕면의 감산리 마을을 지나 바다로 유입되는 창고천 하류에 형성된 계곡으로 한대오름 주위를 발원지로 한다. 안덕계곡의 안덕(安德)은 치안치덕(治安治德)의 줄임말로, 태초에 안개가 끼고 하늘과 땅이 진동하며 태산이 솟아날 때 암벽 사이에 물이 흘러 치안치덕한 곳이라 하여 유래된 말이다. 제주도 특유의 계곡미를 보이는 골짜기가 깊게 침식된 유년기곡으로, 용암 동굴 천장이 붕괴하여 형성된 계곡이라는 설도 있다. 안덕계곡은 전체 길이의 절반이 수직 단애를 이루며, 하천 하류에는 협곡에 조면암류 주상 절리와 판상 절리군이 발달되어 있다. 병풍처럼 둘러쳐진 기암절벽과 평평한 암반 바닥에서 유유히 흐르는 맑은 물이 멋스러운 운치를 자아낸다. 계곡의 양쪽에는 난대 수목의 고목이 울창하게 덮여 있으며, 하층 식물을 형성하고 있다. 이곳에는 300여 종의 식물이 분포하는데, 특히 양치식물이 많은 것이 특징이다.",3,,,안덕계곡,63531,Type1,20030925090000,http://tong.visitkorea.or.kr/cms/resource/10/3023810_image2_1.jpg,http://tong.visitkorea.or.kr/cms/resource/10/3023810_image3_1.jpg,50,130,NA,NA01,NA010400,126.3529100773,33.2573294533,6,20250512172029,3,,63531,,,,,,,,,,,,불가,,,,없음,,,,,,,,,,,success,2026-07-13T03:31:32.416094+00:00,,,0,0,0,064-794-9001,,,,,2006년,,가능,,,,,,,,,,,,,연중무휴,,,,,,,,,,,,,,,,상시 개방,,
tourism,3026668,12,안덕월라봉,제주특별자치도 서귀포시 안덕면 감산리,,39,A01,A0101,A01010400,제주특별자치도 서귀포시 안덕면 감산리,,39,A01,A0101,A01010400,Type3,20230912105542,http://tong.visitkorea.or.kr/cms/resource/50/3026650_image2_1.jpg,http://tong.visitkorea.or.kr/cms/resource/50/3026650_image3_1.jpg,"<a href=""https://www.visitjeju.net/kr/detail/view?contentsid=CNTS_200000000012139""target=""_blank"" title=""새창: 비짓제주 홈페이지로 이동"">https://www.visitjeju.net/</a>",50,130,NA,NA01,NA010100,126.3497828747,33.2436725784,6,20250414162107,"월라봉은 서귀포시 안덕면 감산리마을의 오름이다. 오름 모양새가 마치 달이 떠오르는 모습같다하여 붙여진 이름이다. 다래 나무가 많이 자생하고 있어 다래오름이라고도 불린다. 북동쪽과 남서쪽으로 개석된 두 개의 말굽형 화구로 이루어져 있다. 오름의 남서사면을 돌고 돌아 정상을 오르고 내릴 수 있도록 탐방로가 잘 되어 있다. 오름의 표고는 낮은 편이지만 화순리와 대평리를 걸쳐 있을 정도로 넓은 면적을 자랑하기 때문에 정상까지 약 1시간 정도가 소요되며 오름 초심자들도 정상까지 쉽게 오를 수 있다. 정상에서는 서귀포 해안 풍경 속의 산방산, 화순 앞바다, 형제섬 등을 조망할 수 있다. 월라봉은 서쪽 화순항, 동쪽의 군산과 대평마을, 남쪽 먼쪽 밑에는 주상절리 해안 절벽으로 일몰 명소인 박수기정, 북쪽으로는 사시사철 물이 흐르는 모습을 볼 수 있는 명승지인 안덕계곡이 있다. 기생화산인 월라봉은 그 이름에서 낭만이 느껴지기도 하지만 사실 아픈 전생의 역사 흔적도 간직하고 있는 오름이다. 정상에서 조금 내려오다보면 여러 개의 진지동굴을 볼 수 있는데, 월라봉 진지동굴은 일제강점기 때 화순항으로 상륙하는 미군을 저지하기 위한 최후의 저항기지였다고 한다. 그래서 월라봉은 오름 등반은 물론 진지동굴까지 함께 둘러볼 수 있는 다크투어리즘 역사 현장이다. 태평양 전쟁이 끝난지 거의 80년이 지났어도 월라봉에는 총 7개의 일제 진지동굴이 확인되었고 다른 곳의 진지동굴보다 유난히 깊고 둥근 형태로 수풀까지 우거진 채 보존이 잘 되어 있다. 길을 따라 올라가다보면 안내판이 나오는데 왕복으로 하면  짧지 않은 길이지만 목재데크, 목재계단, 식생매트를 깔아 산책길이 잘 조성돼 있다. 초입 계단이 조금은 지루할 수도 있지만 중간에 보이는 산방산의 모습을 보며 오르막을 올라 정상을 보고 진지동굴까지 보면 월라봉은 마무리가 된다. 월라봉에 우뚝 솟은 바위산은그 아래가 절벽이라서 위험해서 현재는 들어갈 수 없다.",3,,,안덕월라봉,63531,Type3,20230912105542,http://tong.visitkorea.or.kr/cms/resource/50/3026650_image2_1.jpg,http://tong.visitkorea.or.kr/cms/resource/50/3026650_image3_1.jpg,50,130,NA,NA01,NA010100,126.3497828747,33.2436725784,6,20250414162107,3,,63531,,,,,,,,,,,,,,,,없음,,,,,,,,,,,success,2026-07-13T03:31:38.815415+00:00,,,0,0,0,제주시 관광정보센터 064-740-6000,,,,,,,가능,,,,,,,,,,,,,연중무휴,,,,,,,,,,,,,,,,상시 개방,,
tourism,2724387,12,안돌오름,제주특별자치도 제주시 구좌읍 송당리 산 66-2,,39,A01,A0101,A01010400,제주특별자치도 제주시 구좌읍 송당리 산 66-2,,39,A01,A0101,A01010400,Type3,20210705200821,http://tong.visitkorea.or.kr/cms/resource/57/3523657_image2_1.jpg,http://tong.visitkorea.or.kr/cms/resource/57/3523657_image3_1.jpg,"<a href=""https://www.visitjeju.net/kr/detail/view?contentsid=CONT_000000000500413""target=""_blank"" title=""새창 : 비짓제주 홈페이지로 이동"">https://www.visitjeju.net</a>",50,110,NA,NA01,NA010100,126.7560844718,33.4573054352,6,20250819173243,"구좌읍 송대천간 도로 건영목장 입구 주변에서 서쪽방향으로 바라보면 세 오름이 나란히 있는데, 제일 왼쪽의 도로가에 붙어 있는 것이 거슨세미, 오른쪽에 나란히 안돌오름, 밧돌오름이다. 남서쪽에 있는 안돌오름은 안쪽에 들어앉아 있어서 안돌오름(內石岳)이라 부르고 있으며, 웃송당에서 송당공동묘지를 돌아 들어가면 오름 앞에 이르게 된다. 안돌오름은 북서쪽 봉우리가 정상이고, 남동쪽 봉우리와의 사이에 동쪽으로 골이 파여 있는 형태로 말굽형 화구를 이루면서, 화구 안사면의 골이 패인 곳에서만 유일하게 나무가 우거져 자연림의 숲을 이루고 있는 특징을 보이며, 그 외 사면은 매끈한 풀밭오름이다.",4,,,안돌오름,63355,Type3,20210705200821,http://tong.visitkorea.or.kr/cms/resource/57/3523657_image2_1.jpg,http://tong.visitkorea.or.kr/cms/resource/57/3523657_image3_1.jpg,50,110,NA,NA01,NA010100,126.7560844718,33.4573054352,6,20250819173243,4,,63355,,,,,,,,,,,,,,,,,,,,,,,,,,,success,2026-07-13T03:31:39.457788+00:00,,,0,0,0,제주관광정보센터 064-740-6000,,,,,,,가능,,,,,,,,,,,,,연중무휴,,,,,,,,,,,,,,,,※ 통제될 수 있으므로 방문 시 전화문의 요망,,
tourism,2778897,12,안성리수국길,제주특별자치도 서귀포시 대정읍 안성리,,39,A01,A0101,A01010500,제주특별자치도 서귀포시 대정읍 안성리,,39,A01,A0101,A01010500,Type1,20211124233746,http://tong.visitkorea.or.kr/cms/resource/77/3585277_image2_1.jpg,http://tong.visitkorea.or.kr/cms/resource/77/3585277_image3_1.jpg,,50,130,NA,NA05,NA050100,126.2837741374,33.2696992239,6,20251217133800,안성리수국길은 관광지로 개발된 곳이 아니라 마을에 살고 계신 노부부께서 돌담에 심어 놓은 수국들이 멋진 장관을 이뤄 사람들이 방문하여 유명해진 곳이다. 개발 지역이 아니기에 주차장이 따로 마련되어 있지 않아 수국이 피는 시기에 방문하면 혼잡할 수 있다. 수국 개화 시기에 따라 다르지만 6월 중순쯤 마을에 들어서면 양쪽 돌담 사이 쭉 피어있는 수국 풍경을 감상할 수 있다. 수국이 만개하는 시기에는 아름다운 순간을 담기 위해 웨딩 촬영으로도 많이 온다. 관광명소로 개발된 곳이 아닌 주민들이 사는 동네이기에 조용히 감상하는 것이 좋다.,3,,,안성리수국길,63520,Type1,20211124233746,http://tong.visitkorea.or.kr/cms/resource/77/3585277_image2_1.jpg,http://tong.visitkorea.or.kr/cms/resource/77/3585277_image3_1.jpg,50,130,NA,NA05,NA050100,126.2837741374,33.2696992239,6,20251217133800,3,,63520,,,,,,,,,,,,,,,,,,,,,,,,,,,success,2026-07-13T03:31:44.293769+00:00,,,0,0,0,서귀포종합관광안내소 064-732-1330,,,,,,,불가능,,,,,,,,,,,,,연중무휴,,,,,,,,,,,,,,,,상시 개방,,
tourism,4063885,12,안친오름,제주특별자치도 제주시 구좌읍 송당리 880-1,,,,,,제주특별자치도 제주시 구좌읍 송당리 880-1,,,,,,Type3,20260512174445,https://tong.visitkorea.or.kr/cms/resource/72/4063872_image2_1.jpg,https://tong.visitkorea.or.kr/cms/resource/72/4063872_image3_1.jpg,비짓제주 https://www.visitjeju.net/,50,110,NA,NA01,NA010100,126.785714,33.478751,,20260527162519,"제주에 위치한 안친오름은 아진오름, 좌악(座岳), 좌치악(座置岳), 아친악(雅親岳) 등 여러 별칭이 있다. 오름의 형상이 두 다리를 벌리고 앉아 있는 사람의 모양과 닮은 데서 유래한 명칭이다. 또한 안친오름의 ‘안친’은 ‘앉히다’에 대응하는 제주어 ‘안치다’의 관형사형으로, 오름의 형세가 ‘나지막하게 앉힌 솥과 같다’는 데서 유래하였다. 높이 192m, 둘레 924m, 총면적 4만 6443m² 규모의 기생 화산이다. 전체적으로 나지막하며 북쪽 비탈면에 북쪽으로 입구가 벌어진 말굽형 분화구가 있고, 분화구 안쪽의 넓은 풀밭 한가운데에는 여러 개의 묘가 자리 잡고 있다. 안친오름은 송당리 본동 북쪽에 있는 오름으로 형태가 나지막하기 때문에 오름으로 인식하기 어려우며 안친오름 일대는 대부분 농경지로 조성되어 있다.

(출처 : 비짓제주)",,,,안친오름,63355,Type3,20260512174445,https://tong.visitkorea.or.kr/cms/resource/72/4063872_image2_1.jpg,https://tong.visitkorea.or.kr/cms/resource/72/4063872_image3_1.jpg,50,110,NA,NA01,NA010100,126.785714,33.478751,,20260527162519,,,63355,,,,,,,,,,,,,,,,,,,,,,,,,,,success,2026-07-13T03:31:47.788761+00:00,,,0,0,0,010-3692-2423,,,,,,,가능,,,,,,,,,,,,,연중무휴,,,,,,,,,,,,,,,,상시 개방,,
