tourism,128777,12,돌하르방미술관,제주특별자치도 제주시 조천읍 북촌서1길 70,,39,A02,A0202,A02020700,제주특별자치도 제주시 조천읍 북촌서1길 70,,39,A02,A0202,A02020700,Type3,20060203090000,http://tong.visitkorea.or.kr/cms/resource/99/3077599_image2_1.jpg,http://tong.visitkorea.or.kr/cms/resource/99/3077599_image3_1.jpg,"<a href=""https://www.visitjeju.net/kr/detail/view?contentsid=CONT_000000000500150""target=""_blank"" title=""새창: 비짓제주 홈페이지로 이동"">https://www.visitjeju.net</a>",50,110,VE,VE03,VE030100,126.6896605755,33.5396035971,6,20251027163630,"돌하르방미술관은 제주시 조천읍에 위치한 미술관이다. 이곳은 제주 토박이 김남흥 원장이 15년 이상의 세월 동안 개인의 힘으로 일구어온 생명과 평화의 공원이자 문화와 예술을 담은 공원이다. 도 내외에 흩어져 있는 48기의 돌하르방을 원형 그대로 재현해 전시하고 있을 뿐만 아니라 현대적인 해석으로 탄생한 다양한 형태의 돌하르방과 250여 개의 조형물들을 공원 곳곳에서 야외 전시하고 있다. 또, 곶자왈 산책길에서는 각종 양치식물과 청미래덩굴, 자귀나무, 꾸지뽕나무 등 다양한 수목을 관찰할 수 있어 살아 숨 쉬는 자연을 그대로 접할 수 있다.",4,,,돌하르방미술관,63339,Type3,20060203090000,http://tong.visitkorea.or.kr/cms/resource/99/3077599_image2_1.jpg,http://tong.visitkorea.or.kr/cms/resource/99/3077599_image3_1.jpg,50,110,VE,VE03,VE030100,126.6896605755,33.5396035971,6,20251027163630,4,,63339,,,,,,,,,,,,,,,,,,,,,,,,,,,success,2026-07-13T03:36:39.908629+00:00,,,0,0,0,064-782-0570,,,,,,,가능,,,,,,,,,,,,,연중무휴,,,,,,,,,,,,,,,,"[하절기(4월~10월)]<br>
09:00~18:00 (입장 마감 17:30)<br>
[동절기(11월~3월)]<br>
09:00~17:00 (입장 마감 16:30)",,
tourism,1906211,12,두맹이골목,제주특별자치도 제주시 동문로16길 17-4 (일도이동),,39,A02,A0203,A02030600,제주특별자치도 제주시 동문로16길 17-4 (일도이동),,39,A02,A0203,A02030600,Type3,20140319001305,http://tong.visitkorea.or.kr/cms/resource/20/3384820_image2_1.jpg,http://tong.visitkorea.or.kr/cms/resource/20/3384820_image3_1.jpg,"<a href=""https://www.visitjeju.net/kr/detail/view?contentsid=CONT_000000000500161#"" target=""_blank"" title=""새창 : 비짓제주 홈페이지로 이동"">https://www.visitjeju.net/kr</a>",50,110,VE,VE04,VE040100,126.5349218725,33.5120458378,6,20250325112311,"두맹이골목은 제주시 일도2동에 위치한 벽화마을이다. 이 골목 일대는 제주시에서도 가장 낙후되었던 곳 중 하나로, 2008년부터 이 골목을 대상으로 한 문화거리조성 프로젝트가 시작되었다. 첫해에는 한국민족예술인총연합 제주도지회가 공공미술공모사업을 진행해 당선된 작품을 골목에 벽화로 채워 넣기 시작했다. 이후에는 제주 지역 대학생들과 인근 초등학교 학생들이 참여하여 더 많은 벽화를 그렸다. 두맹이골목은 2009년 7월 제주시가 선정한 제주시 숨은 비경 31중 하나로 선정되었으며 다양한 벽화를 감상하면서 조용한 제주 마을을 거닐 수 있다.",4,,,두맹이골목,63265,Type3,20140319001305,http://tong.visitkorea.or.kr/cms/resource/20/3384820_image2_1.jpg,http://tong.visitkorea.or.kr/cms/resource/20/3384820_image3_1.jpg,50,110,VE,VE04,VE040100,126.5349218725,33.5120458378,6,20250325112311,4,,63265,,,,,,,,,,,,불가,,,,없음,,,,,,,,,,,success,2026-07-13T03:36:40.007510+00:00,,,0,0,0,064-728-4436,,,,,,,불가능,,,,,,,,,,,,,연중무휴,,,,,,,,,,,,,,,,,,
tourism,3559559,12,두머니물공원,제주특별자치도 서귀포시 법환동,1534,,,,,제주특별자치도 서귀포시 법환동,1534,,,,,Type1,20251031092656,https://tong.visitkorea.or.kr/cms/resource/54/3559554_image2_1.jpg,https://tong.visitkorea.or.kr/cms/resource/54/3559554_image3_1.jpg,,50,130,VE,VE03,VE030100,126.5073,33.231,6,20260309173002,"서귀포시에 위치한 두머니물공원은 범섬이 보이는 작은 규모의 공원이다. 법환마을과 강정마을의 경계선에 있는데 역사적 고증이 없어 확실하게는 알지 못하나 두면이(頭面怡) 물이라 해서 머리 두, 낯 면, 화할 이로 풀이하고 있다. 경계에 위치해 사소한 이해관계로 충돌이 생길 수 있어 상호 조심스럽게 대하는데, 책임자 또는 상군들이 만나 인사를 나누고 화합을 다지는 장소이기도 하다. 그래서 두면이물이라고도 불려지고 있다. 공원에서 걷기 시작하면 오른쪽으로 바다가 펼쳐지는데 대표적으로는 범섬이 보이며 멀리있는 섶섬과 문섬도 볼 수 있다. 봄에는 유채꽃이 피어 더욱 아름다우며, 겨울에는 일출과 일몰이 잘보이는 명소이기도 해서 많은 사람들이 방문하고 있다.",,,,두머니물공원,63573,Type1,20251031092656,https://tong.visitkorea.or.kr/cms/resource/54/3559554_image2_1.jpg,https://tong.visitkorea.or.kr/cms/resource/54/3559554_image3_1.jpg,50,130,VE,VE03,VE030100,126.5073,33.231,6,20260309173002,,,63573,,,,,,,,,,,,,,,,,,,,,,,,,,,success,2026-07-13T03:36:40.125386+00:00,,,0,0,0,서귀포종합관광안내소 064-732-1330,,,,,,,불가능,,,,,,,,,,,,,연중무휴,,,,,,,,,,,,,,,,상시 개방,,
tourism,3063420,14,디앤디파트먼트,제주특별자치도 제주시 탑동로2길 3 (삼도이동),,,,,,제주특별자치도 제주시 탑동로2길 3 (삼도이동),,,,,,Type1,20231201144844,https://tong.visitkorea.or.kr/cms/resource/61/3552761_image2_1.jpg,https://tong.visitkorea.or.kr/cms/resource/61/3552761_image3_1.jpg,공식 홈페이지 https://d-jeju.arario.com공식 인스타그램 https://www.instagram.com/d_d_jeju,50,110,VE,VE12,VE120300,126.52331515099465,33.51770459484915,6,20260331094113,"D&DEPARTMENT JEJU는 ‘LONG LIFE DESIGN’ 철학을 바탕으로 제주의 일상과 오래된 것의 가치를 새롭게 조명한다. 이곳은 단순히 소비를 위한 장소가 아니라 지역성과 지속 가능성을 바탕으로 오래 사용할 수 있는 물건과 지속가능성에 대한 가치를 공유하는 것을 목표로 한다. 1층은 d카페로 운영되어 제주산 재료를 활용한 음료와 디저트, 브런치를 맛볼 수 있고 제주 생산자들의 생산품도 함께 판매한다. 2층은 d스토어로, 제주의 공예품과 생활용품은 물론 D&DEPARTMENT에서 엄선한 롱라이프디자인 상품도 함께 선보인다. 이곳에서는 가구, 식기, 서적, 패션 등 일상 속에서 오래도록 사용할 수 있는 제품을 판매하며 한국과 일본, 그리고 지역다운 제주 생산자들의 상품들을 한곳에서 만날 수 있다. D&DEPARTMENT JEJU는 소비 욕구를 부추기는 상품이 아닌 계속해서 사용하고 싶은 물건, 오래 지속될 수 있도록 응원하고 싶은 상품을 찾아 판매하고 그 물건이 탄생한 지역과 생산자의 이야기를 함께 손님에게 전하고 있다.",,,,디앤디파트먼트,63165,Type1,20231201144844,https://tong.visitkorea.or.kr/cms/resource/61/3552761_image2_1.jpg,https://tong.visitkorea.or.kr/cms/resource/61/3552761_image3_1.jpg,50,110,VE,VE12,VE120300,126.52331515099465,33.51770459484915,6,20260331094113,,,63165,,,,,,,,,,,,,,,,,,,,,,,,,,,success,2026-07-13T03:36:40.988683+00:00,,,,,,,스토어 064-753-9902카페 064-753-9903,,,,,,,,,,,,,,,,,,,,매주 수요일,,,,,,,,,,,,무료,,,,10:30~18:30,
tourism,984611,32,라온호텔 앤 리조트,제주특별자치도 제주시 한림읍 금능남로 127,,,,,,제주특별자치도 제주시 한림읍 금능남로 127,,,,,,Type1,20100324220906,https://tong.visitkorea.or.kr/cms/resource/66/4074866_image2_1.jpg,https://tong.visitkorea.or.kr/cms/resource/66/4074866_image3_1.jpg,,50,110,VE,VE05,VE050200,126.2396062771,33.3796752710,6,20260615092934,"환상의 한림 앞바다와 비양도, 순백의 한라산이 조화를 이루는 천혜의 자연입지에 국내외 전문가들이 혼심의 힘을 다하여 빚어낸 호텔과 리조트이다. 라온호텔 앤 리조트는 특급호텔과 페어웨이가 한눈에 조망되는 자연 친화형 리조트 단지로 이루어져 있어 고객 취향에 따라 호텔과 리조트를 선택할 수 있으며 에메랄드 빛 바다와 비양도 푸른 골프 코스를 한눈에 내려다 볼 수 있는 곳이다.",,,,라온호텔 앤 리조트,63015,Type1,20100324220906,https://tong.visitkorea.or.kr/cms/resource/66/4074866_image2_1.jpg,https://tong.visitkorea.or.kr/cms/resource/66/4074866_image3_1.jpg,50,110,VE,VE05,VE050200,126.2396062771,33.3796752710,6,20260615092934,,,63015,,,,,0,0,0,0,0,15:00,11:00,,,,,,,,,,,,,,,,success,2026-07-13T03:36:41.105043+00:00,0,,,,,,,,064-796-3300,0,,,,,,,,가능,,0,0,,,,,,,,,디럭스 싱글 가든 / 디럭스 트윈 오션 / 디럭스 트윈 가든 / 코너 트윈 오션 / 주니어 스위트 가든 / 슈페리어 스위트 오션 등,0,,,,0,,0,연회장 / 비즈니스센터 / 휘트니스센 등,,,,,,
tourism,935073,32,라헨느리조트,제주특별자치도 제주시 명림로 384,,,,,,제주특별자치도 제주시 명림로 384,,,,,,Type3,20100122190546,https://tong.visitkorea.or.kr/cms/resource/97/1994497_image2_1.jpg,https://tong.visitkorea.or.kr/cms/resource/97/1994497_image3_1.jpg,,50,110,VE,VE05,VE050200,126.615233587256,33.4522505840842,6,20260213155736,"라헨느리조트는 유럽의 휴양지에 온 듯한 고품격 골프텔, 허브류 등 다양한 초화류를 식재, 향기로운 기운이 가득한 야생초 화원, 산책로와 이어지는 자리에 주변 자연경관을 한눈에 내려다 볼 수 있는 전망 좋은 쉼터 언덕을 조성하였다. 이국적인 야외수영장에서 다양한 이벤트가 연출된다. 필렉스룸 등을 갖춘 호텔급 테라피 시설로 마사지등 다양한 서비스를 제공하며, 레스토랑, 커피숍, 노래방, 오락실 등 다양한 부대편의시설은 편리하게 이용할 수 있다. 또한 최첨단 운동기구가 설치된 헬스센터에서 건강한 육체를 단련할 수 있다.",,,,라헨느리조트,63313,Type3,20100122190546,https://tong.visitkorea.or.kr/cms/resource/97/1994497_image2_1.jpg,https://tong.visitkorea.or.kr/cms/resource/97/1994497_image3_1.jpg,50,110,VE,VE05,VE050200,126.615233587256,33.4522505840842,6,20260213155736,,,63313,,,,,0,0,0,0,0,14:00,12:00,,,,불가,,,,,,,,,,,,success,2026-07-13T03:36:41.203895+00:00,0,,,,,,,,064-754-9000,0,,,,,,,,가능,,0,0,,,,,,,,51실,37형 / 50형,0,,,,0,,0,골프장 / 연회장 / 티하우스 등,,,,,,
tourism,2940981,12,루나폴,제주특별자치도 서귀포시 일주서로 1836,,39,A02,A0202,A02020600,제주특별자치도 서귀포시 일주서로 1836,,39,A02,A0202,A02020600,Type3,20230105163315,http://tong.visitkorea.or.kr/cms/resource/85/3423685_image2_1.jpg,http://tong.visitkorea.or.kr/cms/resource/85/3423685_image3_1.jpg,"<a href=""https://www.instagram.com/lunafall_jeju"" target=""_blank"" title=""새창 : 공식 인스타그램으로 이동"">https://www.instagram.com/lunafall_jeju</a>",50,130,VE,VE02,VE020100,126.3219962251,33.2514073999,6,20250512153917,"루나폴은 거대한 규모의 나이트 디지털 테마파크이다. ‘예로부터 사람들은 달에 소원을 빌었고, 소원이 가득 쌓여 무거워진 달이 제주에 떨어졌다’라는 스토리를 기반으로 밤길을 걸으며 즐기는 몰입형 체험 콘텐츠를 제공한다. 루나폴은 미디어아트와 홀로그램 등 실감미디어 기술력으로 꾸며진 총 9개의 체험존으로 구성되어 있다. 루나폴 세계관을 재현한 루나 빌리지, 달의 민족 루나리안, 달의 민족들이 사용한 언어 루나리안어 등 세계관이 매우 풍부하게 구현되어 있어 몰입도를 더욱 높인다. 루나폴만의 세계관과 제주의 청정자연, 최정상 실감미디어 기술력이 만난 루나폴 판타지는 곶자왈이 포함된 천연 보호구역으로 비포장 숲길이 포함되어 있으므로, 일부 동선에 주의를 요하기에 안전하고 편안한 신발과 복장을 추천한다.",3,,,루나폴,63527,Type3,20230105163315,http://tong.visitkorea.or.kr/cms/resource/85/3423685_image2_1.jpg,http://tong.visitkorea.or.kr/cms/resource/85/3423685_image3_1.jpg,50,130,VE,VE02,VE020100,126.3219962251,33.2514073999,6,20250512153917,3,,63527,,,,,,,,,,,,불가,,,,가능,,,,,,,,,,,success,2026-07-13T03:36:41.321892+00:00,,,0,0,0,064-794-9680,,,,,,,가능,,,,,,,,,,,,,연중무휴,,,,,,,,,,,,,,,,"20:00~24:00 (입장 마감 23:00)<br>
※ 계절별 운영시간 변동될 수 있으므로 전화문의 요망",,
tourism,2007416,32,루체빌리조트,제주특별자치도 서귀포시 안덕면 산록남로 786,,,,,,제주특별자치도 서귀포시 안덕면 산록남로 786,,,,,,Type3,20150603184905,https://tong.visitkorea.or.kr/cms/resource/90/2007390_image2_1.jpg,https://tong.visitkorea.or.kr/cms/resource/90/2007390_image3_1.jpg,,50,130,VE,VE05,VE050200,126.385169081851,33.3198734200885,6,20260305095851,"2014년 7월 오픈한 루체빌리조트는 호텔형 프리미엄 리조트로서 총 5가지 타입, 총 65개의 객실로 이루어져 있다. 도심 속에서 벗어나 제주만의 아름답고 따뜻한 힐링이 필요하다면 서귀포에 위치한 루체빌리조트를 추천한다.",,,,루체빌리조트,63525,Type3,20150603184905,https://tong.visitkorea.or.kr/cms/resource/90/2007390_image2_1.jpg,https://tong.visitkorea.or.kr/cms/resource/90/2007390_image3_1.jpg,50,130,VE,VE05,VE050200,126.385169081851,33.3198734200885,6,20260305095851,,,63525,,,,,0,0,0,0,0,15:00,11:00,,,,불가능,,,,,,,,,,,,success,2026-07-13T03:36:41.967420+00:00,0,,,,,,,,064-805-0114,0,,,,,,,,가능,,0,0,,,,,,,,65실,스탠다드 /  디럭스 / 패밀리 / 스위트,0,,,"25.960㎡, 3층",0,,0,"포도뮤지엄, 컨퍼런스룸, 북카페, 스포츠홀, 편의점, 세탁실",,,,,,
tourism,129145,12,마라도 등대,"제주특별자치도 서귀포시 대정읍 마라로 (165, 마라도항로표지관리소)",,39,A01,A0101,A01011600,"제주특별자치도 서귀포시 대정읍 마라로 (165, 마라도항로표지관리소)",,39,A01,A0101,A01011600,Type3,20060713090000,http://tong.visitkorea.or.kr/cms/resource/90/3400790_image2_1.jpg,http://tong.visitkorea.or.kr/cms/resource/90/3400790_image3_1.jpg,"<a href=""https://www.visitjeju.net/kr/detail/view?contentsid=CNTS_000000000018504""target=""_blank"" title=""새창: 마라도등대"">https://www.visitjeju.net</a>",50,130,VE,VE01,VE010800,126.2692287758,33.1170102919,6,20251224133705,"대한민국 국토 최남단에 있는 푸른 잔디밭 끝에 걸쳐 바다를 향하고 있는 마라도 등대는 동중국해와 제주도 남부 해역을 오가는 선박들이 육지 초인 표지로 이용하고 있는 우리나라의 희망봉 등대이다. 일제강점기인 1915년 3월 최초 건립된 등대는 1987년 3월에 개축하였고, 하얀색의 8각형 콘크리트 구조로 높이는 16m이다. 등질은 10초에 한 번씩 반짝이고 약 48km 거리에서도 확인이 가능하다. 
마라도 성당과 인접해 있어 함께 사진을 찍는 명소로도 인기가 있으며 등대 앞에는 세계 유명 등대의 모형과 세계 전도를 대리석으로 디자인하여 보여주고 있어 아이들에게도 교육적으로 접근할 수 있다. 등대가 위치한 마라도는 섬 전체가 천연기념물로 지정될 만큼 아름다운 자연경관을 지니고 있으며 국토 최남단비,애기업개할망당, 장군바위, 해안침식 동굴, 산방산 등 볼거리 많다.
마라도에 들어가려면 운진항 여객터미널이나 산이수동항의 [마라도 가는 여객선]에서 출항하는 배를 타고 가야 한다.",3,,,마라도 등대,63515,Type3,20060713090000,http://tong.visitkorea.or.kr/cms/resource/90/3400790_image2_1.jpg,http://tong.visitkorea.or.kr/cms/resource/90/3400790_image3_1.jpg,50,130,VE,VE01,VE010800,126.2692287758,33.1170102919,6,20251224133705,3,,63515,,,,,,,,,,,,,,,,,,,,,,,,,,,success,2026-07-13T03:36:42.060873+00:00,,,0,0,0,064-792-8507,,,,,1915-03-15,,불가능,,,,,,,,,,,,,연중무휴,,,,,,,,,,,,,,,,"[마라도 등대]<br>
- 09:00~18:00<br>

[운진항 여객터미널] <br>
- 09:40~15:50<br>

[마라도 가는 여객선 / 산이수동항] <br>
- 09:20~16:10 <br>
※ 사전 전화문의 필수",,
tourism,3545735,14,만춘서점,제주특별자치도 제주시 조천읍 함덕로 9,,,,,,제주특별자치도 제주시 조천읍 함덕로 9,,,,,,Type1,20250930102632,https://tong.visitkorea.or.kr/cms/resource/50/3545550_image2_1.jpg,https://tong.visitkorea.or.kr/cms/resource/50/3545550_image3_1.jpg,,50,110,VE,VE12,VE120100,126.67343088634944,33.54072434423091,6,20260406170427,"만춘서점은 2016년에 시작한 제주 함덕의 독립서점이다. 여행자와 일상인 모두에게 열린 이 공간은 책을 통해 잠시 머물고 쉬어갈 수 있는 여유를 선사한다. 제주 감성이 깃든 책들과 소품이 어우러져 따뜻한 분위기를 자아내며, 바다와 가까운 위치 덕분에 산책길에 들르기 좋은 곳이다. 1호점과 2호점이 나란히 옆으로 자리하고 있다.",,,,만춘서점,63333,Type1,20250930102632,https://tong.visitkorea.or.kr/cms/resource/50/3545550_image2_1.jpg,https://tong.visitkorea.or.kr/cms/resource/50/3545550_image3_1.jpg,50,110,VE,VE12,VE120100,126.67343088634944,33.54072434423091,6,20260406170427,,,63333,,,,,,,,,,,,,,,,,,,,,,,,,,,success,2026-07-13T03:36:42.153040+00:00,,,,,,,064-784-6137,,,,,,,,,,,,,,,,,,,,연중무휴,,,,,,,,,,,,,,,,11:00~18:00,
tourism,1329201,12,메이즈랜드,제주특별자치도 제주시 구좌읍 비자림로 2134-47,,,,,,제주특별자치도 제주시 구좌읍 비자림로 2134-47,,,,,,Type3,20110712224139,https://tong.visitkorea.or.kr/cms/resource/38/4078338_image2_1.jpg,https://tong.visitkorea.or.kr/cms/resource/38/4078338_image3_1.jpg,http://www.mazeland.co.kr,50,110,VE,VE02,VE020100,126.8006766329,33.4887187821,4,20260624092855,"메이즈랜드는 최장을 자랑하는 석축미로를 보유한 제주의 종합테마파크로 제주의 명물인 돌, 바람, 여자를 뜻하는 삼다(三多)를 테마로 하여 조성됐다.  현무암과 송이석으로 만든 돌미로에서는 원적외선과 음이온을, 미측백나무로 만든 바람미로에서는 피톤치드를 누릴 수 있다. 미로퍼즐박물관에서는 체험을 통해 학생들이 과학적, 수리적 능력을 배양할 수 있으며 미로의 기원 설화와 14세기부터 현재까지의 미로와 관련된 유물을 관람할 수 있는 공간을 제공한다. 애지앙길과 야외에는 석공명장 장공익 선생의 제주 설화와 전설이 깃든 해학적인 석상들도 만날 수 있다.",,,,메이즈랜드,63351,Type3,20110712224139,https://tong.visitkorea.or.kr/cms/resource/38/4078338_image2_1.jpg,https://tong.visitkorea.or.kr/cms/resource/38/4078338_image3_1.jpg,50,110,VE,VE02,VE020100,126.8006766329,33.4887187821,4,20260624092855,,,63351,,,,,,,,,,,,,,,,,,,,,,,,,,,success,2026-07-13T03:36:42.887739+00:00,,,0,0,0,064-784-3838,,,,,,,가능,,,,,,,,,,,,,연중무휴,,,,,,,,,,,,,,,,- 09:00~18:00- 매표 마감 17:00※ 계절별로 이용시간이 상이하므로 자세한 이용시간은 공식 홈페이지 참조,,
tourism,2751836,14,바이나흐튼 크리스마스박물관,제주특별자치도 서귀포시 안덕면 평화로 654,,39,A02,A0206,A02060100,제주특별자치도 서귀포시 안덕면 평화로 654,,39,A02,A0206,A02060100,Type1,20210930183004,http://tong.visitkorea.or.kr/cms/resource/82/3548182_image2_1.jpg,http://tong.visitkorea.or.kr/cms/resource/82/3548182_image3_1.jpg,"<a href=""https://www.instagram.com/christmas_museum/"" target=""_blank"" title=""새창 :  공식 인스타그램으로 이동"">https://www.instagram.com/christmas_museum/</a>",50,130,VE,VE07,VE070100,126.3278198313,33.2913419690,6,20251023143000,"서귀포시 안덕면에 위치한 바이나흐튼 크리스마스 박물관은 주인 부부가 여행하며 모은 크리스마스 장식과 관련 물품이 전시되어 있다. 독일어로 크리스마스를 뜻하는 ‘바이나흐튼’과 독일의 건축물을 참고해 만들어 유럽의 크리스마스 느낌이 물씬 나는 공간이다. 개인 박물관치곤 전시물의 종류도 다양하고 소장 가치가 뛰어난 것도 많은 편이다. 일 년 내내 크리스마스 분위기를 느낄 수 있는 곳이지만 이곳의 12월은 조금 더 특별하다. 크리스마스를 맞기 전, 한 달간 크리스마스 마켓 때문이다. 매년 수많은 셀러들이 참여, 크리스마스와 관련된 다양한 라이프스타일 제품들을 판매하며, 유명 셰프들이 만드는 다채로운 요리와 관람객 누구나 참여할 수 있는 다양한 체험 프로그램들이 마련된다.",3,,,바이나흐튼 크리스마스박물관,63522,Type1,20210930183004,http://tong.visitkorea.or.kr/cms/resource/82/3548182_image2_1.jpg,http://tong.visitkorea.or.kr/cms/resource/82/3548182_image3_1.jpg,50,130,VE,VE07,VE070100,126.3278198313,33.2913419690,6,20251023143000,3,,63522,,,,,,,,,,,,,,,,,가능,,,,,,,,,,success,2026-07-13T03:36:43.039571+00:00,,,,,,,0507-1328-7976,,,,,,,가능,무료,,,,,,,,,,,,연중무휴,,,,,,,,,,,,무료,,,,10:30~18:00,
tourism,1883815,14,박물관은살아있다 제주,제주특별자치도 서귀포시 중문관광로 42,,39,A02,A0206,A02060100,제주특별자치도 서귀포시 중문관광로 42,,39,A02,A0206,A02060100,Type1,20140110182434,http://tong.visitkorea.or.kr/cms/resource/96/3548296_image2_1.jpg,http://tong.visitkorea.or.kr/cms/resource/96/3548296_image3_1.jpg,"<a href=""http://www.alivemuseum.com/branch/jeju"" target=""_blank"" title=""새창: 박물관은 살아있다 제주 중문점"">http://www.alivemuseum.com/branch/jeju</a>",50,130,VE,VE07,VE070100,126.4092858005,33.2546667452,6,20251023143000,"여러 가지 테마로 구성된 체험형 아트 뮤지엄으로, 다양한 방식으로 참여하고 사진을 찍으며 즐기는 테마파크이자 미술관이다. 이상한 백작의 집, 블랙원더랜드등 다양한 테마로 구성되어 있어 인생 사진을 남길 수 있다. 그리고 착시테마공간이 있는데 이곳은 평면과 입체 섞인 오브제아트에 재미있는 포즈로 작품을 완성시키는 참여형 공간이다. 이번에 새롭게 선보이는 블랙원더랜드 에피소드 2 전시는 남녀노소 연령에 상관없이 즐길 수 있다.",3,,,박물관은살아있다 제주,63535,Type1,20140110182434,http://tong.visitkorea.or.kr/cms/resource/96/3548296_image2_1.jpg,http://tong.visitkorea.or.kr/cms/resource/96/3548296_image3_1.jpg,50,130,VE,VE07,VE070100,126.4092858005,33.2546667452,6,20251023143000,3,,63535,,,,,,,,,,,,,,,,,가능,,,,,,,,,,success,2026-07-13T03:36:43.774474+00:00,,,,,,,064-805-0888,,,,,,,가능 (승용차 약 100대 / 대형 약 20대),무료,,,,,,,,,,,,연중무휴,,,,,,,,,,,,"[개인]<br>- 성인 14,000원<br>- 청소년 / 군경 13,000원<br>- 어린이 12,000원<br>- 경로 / 장애인 / 국가유공자 12,000원<br>[단체(20인 이상)]<br>- 성인 9,000원<br>- 청소년 / 군경 8,000원<br>- 어린이 7,500원<br>- 경로 / 장애인 / 국가유공자 7,500원<br>※ 단체예약은 전화 문의",,,,10:00~19:00 (입장 마감 18:00),
tourism,2778939,14,밤수지맨드라미 북스토어,제주특별자치도 제주시 우도면 우도해안길 530,,39,A02,A0206,A02061000,제주특별자치도 제주시 우도면 우도해안길 530,,39,A02,A0206,A02061000,Type1,20211124235840,http://tong.visitkorea.or.kr/cms/resource/00/3553400_image2_1.jpg,http://tong.visitkorea.or.kr/cms/resource/00/3553400_image3_1.jpg,"<a href=""https://www.instagram.com/bamsuzymandramy.bookstore"" target=""_blank"" title=""새창 : 우도 밤수지맨드라미책방 사이트로 이동"">http://www.instagram.com/bamsuzymandramy.bookstore/</a>",50,110,VE,VE12,VE120100,126.9484913275,33.5207431980,6,20251023143000,"비행기를 타고 제주에 가서, 또 배를 타고 섬에서 섬으로 들어가면 만날 수 있는 책방. 제주 우도의 유일한 독립서점인 밤수지맨드라미책방이다. 전형적인 제주 돌담으로 둘러싸인 건물 입구엔 ‘책’이라고 적힌 간판이 이곳이 책방이라는 걸 알려준다. 밤수지맨드라미는 제주 바닷속에 사는 멸종 위기 산호로, 책이 사라져 가는 현실이 산호꽃과 닮은 것 같다고 생각해 책방 이름을 밤수지맨드라미라고 지었다고 한다. 책방 내부엔 독립 서적이나 드로잉북, 채식 관련 책들이 구비되어 있다, 책방 창문 너머로는 햇살이 쏟아지는 바다도 눈에 들어온다. 이곳 책방만의 개성을 담은 굿즈들도 판매하고 있으며, 공간 한쪽은 카페처럼 운영돼 구매한 책을 여유롭게 읽어볼 수도 있다.",4,,,밤수지맨드라미 북스토어,63365,Type1,20211124235840,http://tong.visitkorea.or.kr/cms/resource/00/3553400_image2_1.jpg,http://tong.visitkorea.or.kr/cms/resource/00/3553400_image3_1.jpg,50,110,VE,VE12,VE120100,126.9484913275,33.5207431980,6,20251023143000,4,,63365,,,,,,,,,,,,,,,,,,,,,,,,,,,success,2026-07-13T03:36:50.986249+00:00,,,,,,,010-7405-2324,,,,,,,가능,,,,,,,,,,,,,비정기 휴무 <br>※ 공식 인스타그램 참고 바람,,,,,,,,,,,,,,,,10:00~17:00,
