tourism,129403,12,복신미륵,제주특별자치도 제주시 동한두기길 7-6 (용담일동),,39,A02,A0201,A02010700,제주특별자치도 제주시 동한두기길 7-6 (용담일동),,39,A02,A0201,A02010700,Type1,20061122090000,http://tong.visitkorea.or.kr/cms/resource/42/3555142_image2_1.jpg,http://tong.visitkorea.or.kr/cms/resource/42/3555142_image3_1.jpg,,50,110,HS,HS02,HS020300,126.5154401529,33.5155645816,6,20251024092903,"제주의 복신미륵은 한 쌍의 미륵으로 조선시대에 쌓은 제주성을 중심으로 동쪽에 있는 것은 동자복, 서쪽에 있는 것은 서자복이라고 한다.
동자복은 만수사 옛터인 민가 안에 자리하고 있으며, 마을의 평안과 여러 활동의 안전을 기원하는 석불로, 집안의 제액, 육아에 효험이 있다고 하여 제를 올렸으며, 제주성의 동쪽에서 성안을 수호하는 기능도 하였다.
서자복은 용화사 안에 자리하고 있으며 옛날 제주성의 서쪽에서 성 안을 수호하는 기능을 하였다 한다. 돌모자를 쓰고 있으며, 인자하게 내려다보는 눈, 우뚝한 코, 지그시 다문 입, 커다란 귀 등에서 자비로운 모습을 보여준다. 곁에는 남근을 상징하는 동자상이 서 있는데, 여기에 걸터앉아 치성을 드리면 아들을 낳는다고 믿고 있다. 매년 음력 2월 15일과 11월 15일이면 미륵을 위한 불공이 법당 안에서 행하여진다. 정확한 제작 시기는 알 수 없지만 고려시대로 추정하며, 고을을 수호하고 아들 낳기를 바라는 민간신앙과 불교의 결합을 보여주는 예이다.",4,,,복신미륵,63153,Type1,20061122090000,http://tong.visitkorea.or.kr/cms/resource/42/3555142_image2_1.jpg,http://tong.visitkorea.or.kr/cms/resource/42/3555142_image3_1.jpg,50,110,HS,HS02,HS020300,126.5154401529,33.5155645816,6,20251024092903,4,,63153,,,,,,,,,,,,,,,,,,,,,,,,,,,success,2026-07-13T03:35:18.719226+00:00,,,0,0,0,"제주관광정보센터 064-740-6000<br>
용화사 0507-1392-7732",,,,,,,가능,,,,,,,,,,,,,연중무휴,,,,,,,,,,,,,,,,용화사 08:00~20:00,,
tourism,317558,12,불탑사(제주),제주특별자치도 제주시 원당로16길 41,(삼양일동),39,A02,A0201,A02010800,제주특별자치도 제주시 원당로16길 41,(삼양일동),39,A02,A0201,A02010800,Type3,20071204225636,http://tong.visitkorea.or.kr/cms/resource/77/3053877_image2_1.jpg,http://tong.visitkorea.or.kr/cms/resource/77/3053877_image3_1.jpg,"<a href=""https://www.visitjeju.net/kr/detail/view?contentsid=CONT_000000000500262""target=""_blank"" title=""새창: 비짓제주  홈페이지로 이동"">https://www.visitjeju.net/kr/</a>",50,110,HS,HS03,HS030100,126.5978743444,33.5291588377,6,20250416092239,"불탑사는 제주시 삼양동에 위치한 사찰로 대한불교조계종 제23교구 관음사의 말사이다. 불탑사는 원당봉 기슭에 자리하고 있다. 불탑사의 원찰인 원당사는 고려 말 제주도의 3대 사찰 중 하나였다. 1948년에 발생한 제주 4.3 사건 당시 사찰 대부분이 파손되었으며 1953년에 재건했다. 이후 여러 차례의 보수와 확장 작업을 거쳐 오늘에 이른다. 현재 경내에는 대웅전, 요사채, 종각, 천왕문 등이 있으며 특히 이곳에 보존된 오층석탑은 제주도 유일의 고려시대 석탑으로 1993년 11월 보물로 지정되었다.",4,,,불탑사(제주),63316,Type3,20071204225636,http://tong.visitkorea.or.kr/cms/resource/77/3053877_image2_1.jpg,http://tong.visitkorea.or.kr/cms/resource/77/3053877_image3_1.jpg,50,110,HS,HS03,HS030100,126.5978743444,33.5291588377,6,20250416092239,4,,63316,,,,,,,,,,,,불가,,,,없음,,,,,,,,,,,success,2026-07-13T03:35:21.908688+00:00,,,0,0,0,제주시 관광정보센터 064-740-6000,,,,,,,가능,,,,,,,,,,,,,연중무휴,,,,,,,,,,,,,,,,상시 개방,,
tourism,127055,12,사라봉(모충사) 의병항쟁기념탑,제주특별자치도 제주시 사라봉길 75,,39,A02,A0205,A02050200,제주특별자치도 제주시 사라봉길 75,,39,A02,A0205,A02050200,Type3,20031121090000,http://tong.visitkorea.or.kr/cms/resource/89/3400689_image2_1.jpg,http://tong.visitkorea.or.kr/cms/resource/89/3400689_image3_1.jpg,"<a href=""http://www.visitjeju.net/"" target=""_blank"" title=""새창 : 제주 문화관광 홈페이지로 이동"">http://www.visitjeju.net</a>",50,110,HS,HS02,HS020100,126.5470457247,33.5161733522,6,20250324104037,"제주항 위로 보이는 사라봉에 오르면 제주성내를 한눈에 굽어볼 수 있다. 남으로 한라산, 북으로 끝없이 펼쳐진 푸른빛 제주바다, 어느 방향으로나 조망이 아름다운 이 봉우리 아래에 제주 의병 항쟁 기념탑이 서 있다. 1909년 2월 25일 의병장 고사훈 등 10 명의 구국지사들이 발의하여, 1909년 3월 3일을 기해 관덕정 광장에 집결, 일본 관리를 축출하고 국권을 회복하고자 했으나 비밀이 탄로 나 실패로 끝나버린 제주 의병 운동을 기념하기 위해 세워졌다. 모충사 내에 하늘을 찌를 듯 우뚝 솟은 의병항쟁탑 앞에 서면, 일본 침략에 항거한 제주도민의 주체적 항쟁의지가 가슴에 와닿는다. 아래에 2기의 탑이 더 있는데, 하나는 1919년 7월 독립군 군자금 모금사건으로 체포되어 1920년 4월 대구형무소에서 옥사한 조봉호 순국 지사의 기념비이고, 또 하나는 1700년대 말, 제주도 구휼에 앞장섰던 김만덕 할머니의 추모비이다.

김만덕 할머니 (1739 ∼1812)는 가난한 선비의 딸로 태어나 40대에 이르러 큰 부자가 되었다. 1792년경 제주도에 큰 흉년이 들어 약 18,000명이 굶어 죽었는데 김만덕 할머니는 그때까지 번 돈으로 육지에서 식량을 사 와 사람들에게 나눠주었다. 할머니가 자식도 없이 74세로 죽자 나라에서는 벼슬을 내렸다. 추사 김정희는 그녀의 묘비에 찬양하는 글을 남겼으며, 당시 영의정 채제공은 전기를 기록하였다. 사라봉 공원 내에는 그의 묘비와 만덕관이 있다. 매년 한라문화제 때에는 모충사에서 의녀 김만덕 할머니를 기리는 ‘만덕제’가 거행되며 이때 제주도 일원에서 사회봉사에 공헌한 여성을 선정해 만덕봉사상을 수여하고 있다. 세 개의 탑 주위는 향나무, 소나무, 동백나무, 종려나무 등, 다양한 수종으로 아름답게 꾸며져 있어 사라봉과 함께 제주 시민의 소중한 휴식 공간으로 이용되고 있다.",4,,,사라봉(모충사) 의병항쟁기념탑,63284,Type3,20031121090000,http://tong.visitkorea.or.kr/cms/resource/89/3400689_image2_1.jpg,http://tong.visitkorea.or.kr/cms/resource/89/3400689_image3_1.jpg,50,110,HS,HS02,HS020100,126.5470457247,33.5161733522,6,20250324104037,4,,63284,,,,,,,,,,,,불가,,,,없음,,,,,,,,,,,success,2026-07-13T03:35:23.646956+00:00,,,0,0,0,064-722-0614,,,,,,,가능,,,,,,,,,,,,,연중무휴,,,,,,,,,,,,,,,,상시 개방,,
tourism,126457,12,산방굴사(제주),제주특별자치도 서귀포시 안덕면 산방로 218-12,,39,A02,A0201,A02010800,제주특별자치도 서귀포시 안덕면 산방로 218-12,,39,A02,A0201,A02010800,Type3,20021008090000,http://tong.visitkorea.or.kr/cms/resource/60/3384460_image2_1.jpg,http://tong.visitkorea.or.kr/cms/resource/60/3384460_image3_1.jpg,"<a href=""https://www.visitjeju.net/kr/detail/view?contentsid=CONT_000000000500287"" target=""_blank"" title=""새창: 비짓제주 홈페이지로 이동"">http://www.visitjeju.net/kr</a>",50,130,HS,HS03,HS030100,126.3133472902,33.2372560486,6,20251224153509,"온통 절벽으로 이루어진 산방산 중턱에 영주 10경 중의 하나이며 명승인 산방굴사가 자리하고 있다. 안덕면 사계리에 있는 산방산(395m)은 유동성이 적은 조면암질 안산암으로 이루어진 전형적인 종상화산이다. 제주의 많은 오름들과는 달리 정상부에 분화구가 없다. 형성 시기는 대략 70∼80만 년 이전이며 산 중턱에 방이 있어서 산방산이다. 
해발 150m에 있는 이 방은 해식동굴인데 여기를 산방굴이라 부르며 맨 안쪽에 불상을 모시고, 예로부터 산방굴사라고 하였다. 창건 시기는 고려시대라고 알려져 있으며 고려시대의 시승으로 알려진 고승 혜일이 수도했다고 하며, 선사들이 머물다가 간 유서 깊은 곳이기도 하다. 혜일이 모셨던 것으로 알려진 석불은 일제강점기 때 일본인이 가져갔다고 전하며 귀양 왔던 추사 김정희가 즐겨 찾던 곳이기도 하다. 1960년경에 다시 석불좌상을 모신 것을 계기로, 1985년부터는 동굴 안에 지금의 석불좌상을 모셨다. 
굴의 천정에서 계속 물이 떨어지는데 이를 '산방덕이의 눈물'이라고 부른다. 산방굴의 여신인 산방덕이 인간으로 태어나서 고성목이라는 속세의 인간과 결혼하여 행복하게 살았는데 고을의 벼슬아치가 그녀의 미모에 빠져 남편을 잡아가자, 다시 산방굴로 들어가 바위로 굳어 버렸다고 한다. 지금도 산방굴에는 산방덕이 변해서 된 바위 밑으로 한줄기의 물이 쉬지 않고 떨어지며 작은 샘을 이루고 있는데 그 물줄기는 산방덕이 인간 세상에서 사랑했던 고성목을 그리워하며 스스로 기막힌 운명과 현세의 고해를 비탄하여 흘리는 눈물이라 전한다. 
굴 밖에는 형제섬, 가파도, 한국 최남단 영토 마라도와 용머리 해안의 경관이 눈부시게 아름답다. 또 산방산 휴게소에서 10여 분 걸어가면 산방산 앞에 바닷가를 마주할 수 있다. 이곳을  용머리 해안이라 부르는데 용이 머리를 들고 바다로 들어가는 모습에서 용머리라 불린다. 지형이 신비롭고 독특해서 산방산이나 산방굴사를 찾는 관광객들이 이어서 용머리해안을 함께 들른다.",3,,,산방굴사(제주),63528,Type3,20021008090000,http://tong.visitkorea.or.kr/cms/resource/60/3384460_image2_1.jpg,http://tong.visitkorea.or.kr/cms/resource/60/3384460_image3_1.jpg,50,130,HS,HS03,HS030100,126.3133472902,33.2372560486,6,20251224153509,3,,63528,,,,,,,,,,,,,,,,,,,,,,,전 연령,,,,success,2026-07-13T03:35:23.743508+00:00,,,0,0,0,064-794-2940,,,,,,,가능,,,,,,,,,,,,,연중무휴,,,,,,,,,,,,,,,,09:00~18:00 (매표 마감 17:20),,
tourism,2765252,12,새미은총의동산,제주특별자치도 제주시 한림읍 새미소길 15,,39,A02,A0201,A02010900,제주특별자치도 제주시 한림읍 새미소길 15,,39,A02,A0201,A02010900,Type1,20211101191713,http://tong.visitkorea.or.kr/cms/resource/91/3554891_image2_1.jpg,http://tong.visitkorea.or.kr/cms/resource/91/3554891_image3_1.jpg,,50,110,HS,HS03,HS030200,126.3237716904,33.3483050542,6,20251023170220,"새미 은총의 동산은 예수님의 탄생부터 최후의 만찬까지 12개의 주요 사건을 표현한 ‘예수님 생애 공원’과 ‘삼위일체 대성당'이 있는 곳으로, 천주교 제주교구의 성지 순례 장소다. 전체 면적은 약 264,000㎡에 달하며 언제든 신자들이 찾아와 기도할 수 있도록 24시간 개방하고 있다. 또, 성 이시돌 목장 뒤를 순례지로 개발해 넓은 동산과 연못, 성모상과 대형 십자가 등을 볼 수 있게 했다. 야외에서는 동시에 약 5천여 명이 함께 야외 미사를 보거나, 각종 공연이나 행사 공간으로 사용할 수 있다. 최근 많은 사람들이 찾는 여행지로 각광받고 있으며 다양한 조형물과 산책로, 넓은 들판이 있어 종교인이 아니어도 힐링할 수 있는 곳이다.",4,,,새미은총의동산,63021,Type1,20211101191713,http://tong.visitkorea.or.kr/cms/resource/91/3554891_image2_1.jpg,http://tong.visitkorea.or.kr/cms/resource/91/3554891_image3_1.jpg,50,110,HS,HS03,HS030200,126.3237716904,33.3483050542,6,20251023170220,4,,63021,,,,,,,,,,,,,,,,,,,,,,,,,,,success,2026-07-13T03:35:24.877343+00:00,,,0,0,0,성이시돌피정의집평생교육원 064-796-4181,,,,,,,가능,,,,,,,,,,,,,연중무휴,,,,,,,,,,,,,,,,상시 개방,,
tourism,2822432,12,서귀진지,제주특별자치도 서귀포시 솔동산로11번길 8-18 (서귀동),,,,,,제주특별자치도 서귀포시 솔동산로11번길 8-18 (서귀동),,,,,,Type1,20220531163552,https://tong.visitkorea.or.kr/cms/resource/11/4074011_image2_1.jpg,https://tong.visitkorea.or.kr/cms/resource/11/4074011_image3_1.jpg,https://www.cha.go.kr,50,130,HS,HS01,HS011200,126.5644000000,33.2430000000,6,20260611165011,조선시대 대표적인 방어유적으로 3성 9진(三城九鎭)의 하나이다. 최초축성은 1439년대로 판단된다. 본래 홀로 천에 있었으나 조선 선조 23년(1590) 이옥 목사가 현재 위치로 옮겨 축성했다. 일제강점기에는 일본군의 관청으로 사용되다가 제주 4·3 사건 이후 이곳의 성담을 헐어 마을을 방어하는 축성용으로 사용하였고 이후에는 주거용 건축용도와 밧담으로 이용되어 지금에는 당시의 성담이었던 담들 이 ‘우잣담’과 ‘성굽담’으로 일부 남아 있다.,,,,서귀진지,63596,Type1,20220531163552,https://tong.visitkorea.or.kr/cms/resource/11/4074011_image2_1.jpg,https://tong.visitkorea.or.kr/cms/resource/11/4074011_image3_1.jpg,50,130,HS,HS01,HS011200,126.5644000000,33.2430000000,6,20260611165011,,,63596,,,,,,,,,,,,,,,,,,,,,,,,,,,success,2026-07-13T03:35:26.281996+00:00,,,0,0,0,제주세계유산본부 064-710-6704,,,,,,,가능,,,,,,,,,,,,,연중무휴,,,,,,,,,,,,,,,,상시 개방,,
tourism,127520,12,서귀포 김정희 유배지,제주특별자치도 서귀포시 대정읍 추사로 44,,,,,,제주특별자치도 서귀포시 대정읍 추사로 44,,,,,,Type1,20030627090000,https://tong.visitkorea.or.kr/cms/resource/00/3552000_image2_1.jpg,https://tong.visitkorea.or.kr/cms/resource/00/3552000_image3_1.jpg,http:///www.jeju.go.kr/chusa,50,130,HS,HS01,HS010400,126.278322243599,33.2499354176354,6,20260312090840,"추사 김정희(1786~1856) 선생이 조선 헌종 6년(1840) 10월 1일부터 헌종 14년(1848) 12월 6일까지 9년간 유배생활을 하였던 곳이다. 1948년 제주도 4·3 사건 때 불타버리고 빈 터만 남았다가 1984년 강도순 증손의 고증에 따라 다시 지은 것이다. 북학의 대가이며 학예에 출중한 당대의 선구자였던 추사 김정희 선생이 이곳에 다년간 머무름으로써 제주 인문의 일대 혁신의 계기가 되었다. 선생은 금석문과 서화에 능통하였으며, 특히, 서체의 새로운 경지를 개척한 추사체는 널리 알려져 있다.  특히 여기서 그린 ‘세한도(국보)’는 선생의 서화의 경지를 유감없이 발휘한 작품으로 알려져 있다.",,,,서귀포 김정희 유배지,63517,Type1,20030627090000,https://tong.visitkorea.or.kr/cms/resource/00/3552000_image2_1.jpg,https://tong.visitkorea.or.kr/cms/resource/00/3552000_image3_1.jpg,50,130,HS,HS01,HS010400,126.278322243599,33.2499354176354,6,20260312090840,,,63517,,,,,,,,,,,,,,,,,,,,,,,,,,,success,2026-07-13T03:35:26.768187+00:00,,,0,0,0,064-710-6865,,,,,,,가능,,,,,,,,,,,,,"매주 월요일 (단, 월요일이 공휴일일 경우 익일 휴무) / 1월 1일 / 설·추석 연휴",,,,,,,,,,,,,,,,09:00~18:00 (입장 마감 17:30),,
tourism,318339,12,선광사(제주),제주특별자치도 서귀포시 남원읍 태위로510번길 42,,,,,,제주특별자치도 서귀포시 남원읍 태위로510번길 42,,,,,,Type3,20071206191245,https://tong.visitkorea.or.kr/cms/resource/29/3477329_image2_1.jpg,https://tong.visitkorea.or.kr/cms/resource/29/3477329_image3_1.jpg,,50,130,HS,HS03,HS030100,126.6995590489,33.2727088904,6,20260605112258,"제주도 서귀포시에 위치한 선광사는 한국불교태고종 사찰이다. 선광사는 해안 석벽과, 자연의 신비로움을 간직한 해안 동굴들이 태고의 경이로움을 그대로 간직한 채 바다와 맞서고 있는 남원큰엉을 배경으로 하고 있다. 
선광사가 창건된 것은 1942년 보화 법인스님이 법당과 객실을 지으면서부터이다. 1945년에는 1차 중건 불사로 포교활동에 박차를 가했으나, 1948년 4·3사건의 여파로 선광사는 잠시 폐사가 된다. 그 후 4·3사건과 6·25전쟁 등 격동의 세월을 역사와 함께 보내고 나라가 어느 정도 안정을 되찾게 되자, 다시 중창 불사하여 현재 이 지역에서 보기 드물 정도의 사찰 면모를 갖추고 오늘에 이르고 있다.",,,,선광사(제주),63620,Type3,20071206191245,https://tong.visitkorea.or.kr/cms/resource/29/3477329_image2_1.jpg,https://tong.visitkorea.or.kr/cms/resource/29/3477329_image3_1.jpg,50,130,HS,HS03,HS030100,126.6995590489,33.2727088904,6,20260605112258,,,63620,,,,,,,,,,,,불가,,,,,,,,,,,,,,,success,2026-07-13T03:35:30.385734+00:00,,,0,0,0,064-764-0316,,,,,,,가능,,,,,,,,,,,,,연중무휴,,,,,,,,,,,,,,,,상시 개방,,
tourism,2738675,12,선운정사,제주특별자치도 제주시 애월읍 구몰동길 65,,39,A02,A0201,A02010800,제주특별자치도 제주시 애월읍 구몰동길 65,,39,A02,A0201,A02010800,Type3,20210901191635,http://tong.visitkorea.or.kr/cms/resource/59/3399959_image2_1.jpg,http://tong.visitkorea.or.kr/cms/resource/59/3399959_image3_1.jpg,"<a href=""https://www.visitjeju.net/kr/detail/view?contentsid=CNTS_000000000018362"" target=""_blank"" title=""새창 : 비짓제주 홈페이지로 이동"">https://www.visitjeju.net/kr</a>",50,110,HS,HS03,HS030100,126.3071574318,33.4293874894,6,20250324103001,"제주의 정겨운 마을과 운치 있는 농촌 길을 걷다 보면 아름다운 모습을 한 선운정사를 마주할 수 있다.  이 사찰은 제주올레 15코스에 포함된 사찰이다. 불교문화의 전승뿐만 아니라 제주의 문화를 함께 보존하기 위해 노력하는 공간으로, 설문대할망과 오백장군 전각, 소원을 이루어주는 소원석 등 다양한 조형물을 볼 수 있다. 무엇보다 유명한 것은 바로 야경이다. 절터를 은은하게 수놓는 연꽃등과 멋진 야경을 무료로 즐길 수 있어 인기다. 해가 떨어지는 7시쯤부터 경내에 불이 하나 둘 들어오기 시작한다. 수백 개의 LED 연꽃등과 탑, 전각 등을 밝히는 조명이 경내를 채우는 차분한 경전 소리와 어우러진다. 또한 사찰 내에 제주특별자치도 문화유산자료로 지정된 ‘선운정사 석조약사여래좌상’이 있다. 선운정사 석조여래좌상은 조선시대 이래 유행한 약기인의 약사불상의 도상을 정확하게 보여주고 있으며, 통일신라시대부터 조선시대까지 시대의 복합상을 갖춘 불상이다.",4,,,선운정사,63039,Type3,20210901191635,http://tong.visitkorea.or.kr/cms/resource/59/3399959_image2_1.jpg,http://tong.visitkorea.or.kr/cms/resource/59/3399959_image3_1.jpg,50,110,HS,HS03,HS030100,126.3071574318,33.4293874894,6,20250324103001,4,,63039,,,,,,,,,,,,없음,,,,없음,,,,,,,,,,,success,2026-07-13T03:35:30.583299+00:00,,,0,0,0,064-799-8588,,,,,1999년 대웅전 완공,,가능,,,,,,,,,,,,,연중무휴,,,,,,,,,,,,,,,,상시 개방,,
tourism,2798703,12,성산포성당,제주특별자치도 서귀포시 성산읍 고성오조로 120,,,,,,제주특별자치도 서귀포시 성산읍 고성오조로 120,,,,,,,20211215220559,,,,50,130,HS,HS03,HS030200,126.913641954744,33.4539607740169,6,20260312160019,"성산포 성당은 1955년 공소가 설립되어 1973년 본당으로 승격된 성당이다. 이 성당은 멀리 보이는 성산 일출봉과 바다가 어우러져  우리나라에 있는 성당 중에서 가장 경치가 뛰어나다는 찬사를 받는 곳이다. 건물 외관도 독특한데, 현대식 기와지붕이 한쪽만 절개되어 가운데에 얹힌 모양을 가지고 있다. 성당 입구에서 먼저 눈에 보이는 둥근 창 모양으로 뚫린 원통 형태의 종탑 역시 특이하다. 뚫려있는 종탑 안쪽은 제주 바다를 연상하게 하는 푸른색 타일로 장식돼 있다. 올레 2코스와 가까워 여행객들이 잠시 쉬며 둘러보기 좋은 장소다.",,,,성산포성당,63639,,20211215220559,,,50,130,HS,HS03,HS030200,126.913641954744,33.4539607740169,6,20260312160019,,,63639,,,,,,,,,,,,없음,,,,,,,,,,,,,,,success,2026-07-13T03:35:30.685201+00:00,,,0,0,0,064-782-0500,,,,,,,가능,,,,,,,,,,,,,연중무휴,,,,,,,,,,,,,,,,상시 개방,,
tourism,126471,12,성읍민속마을,제주특별자치도 서귀포시 표선면 성읍리,3294,39,A02,A0201,A02010600,제주특별자치도 서귀포시 표선면 성읍리,3294,39,A02,A0201,A02010600,Type1,20030925090000,http://tong.visitkorea.or.kr/cms/resource/64/3551564_image2_1.jpg,http://tong.visitkorea.or.kr/cms/resource/64/3551564_image3_1.jpg,"<a href=""https://www.jeju.go.kr/seongeup/index.htm"" target=""_blank"" title=""새창 : 성읍마을 홈페이지로 이동"">https://www.jeju.go.kr/seongeup/index.htm</a>",50,130,HS,HS01,HS010600,126.7882138165,33.3884302280,6,20251114164908,"표선리에서 북쪽으로 8㎞쯤 가면 한라산 기슭 아래 성읍마을이 있다. 성읍리는 원래 제주도가 방위상 3현으로 나뉘어 통치되었을 때(1410-1914) 정의현의 도읍지였던 마을로서 제주도 옛 민가의 특징을 잘 간직하고 있는 곳이다. 유형·무형의 많은 문화유산이 집단적으로 분포되어 있고, 옛 마을 형태의 민속경관이 잘 유지되어 그 옛 모습을 계속 유지하고자 민속마을로 지정·보호하고 있다. 이곳에서는 옛 민가, 향교, 옛 관공서, 돌하르방, 연자방아, 성터, 비석 등의 유형 문화유산과 중산간 지대 특유의 민요, 민속놀이, 향토음식, 민간공예, 제주방언 등의 무형 문화유산이 아직까지 전수되고 있다. 천연기념물인 느티나무, 팽나무 등은 오백 년 도읍지로서의 긍지를 엿볼 수 있다. 제주 초가를 가장 잘 보존하고 있는 성읍민속마을은 실제로 제주 초가에 살고 있는 성읍리 주민들과 제주의 전통 화장실인 ‘통시’를 만나볼 수도 있다. 특히 마을 내 고목과 돌담 그리고 옛 성벽 등이 어우러진 고풍스러운 모습은 오백 년 도읍지의 역사를 그대로 보여준다.",3,,,성읍민속마을,63624,Type1,20030925090000,http://tong.visitkorea.or.kr/cms/resource/64/3551564_image2_1.jpg,http://tong.visitkorea.or.kr/cms/resource/64/3551564_image3_1.jpg,50,130,HS,HS01,HS010600,126.7882138165,33.3884302280,6,20251114164908,3,,63624,,,,,,,,,,,,,,,,,,,,,,,전 연령,,제주민요체험 / 오메기술체험 / 고소리술체험 / 천연염색 등,,success,2026-07-13T03:35:30.772071+00:00,,,0,0,0,064-710-6797,,,,,,,가능,,,,,,,,,,,,,연중무휴,,,,,,,,,,,,,,,,상시 개방,,
tourism,2789652,12,순례자의 교회,제주특별자치도 제주시 한경면 일주서로 3960-24,,39,A02,A0201,A02010900,제주특별자치도 제주시 한경면 일주서로 3960-24,,39,A02,A0201,A02010900,Type1,20211209000837,http://tong.visitkorea.or.kr/cms/resource/52/3585352_image2_1.jpg,http://tong.visitkorea.or.kr/cms/resource/52/3585352_image3_1.jpg,"<a href=""https://www.visitjeju.net/kr/detail/view?contentsid=CNTS_000000000020195"" target=""_blank"" title=""새창 : 비짓제주 홈페이지로 이동"">https://www.visitjeju.net/kr/</a>",50,110,HS,HS03,HS030200,126.1805486613,33.3198309570,6,20251217140140,"순례자의 교회 제주 올레길 13코스에 위치한 교회로 가장 작은 교회라고 알려져 있다. 예배 시간이 정해지지 않고 방문객을 맞이하는 시설도 없이 조용한 명상과 묵상을 할 수 있게 마련된 예배당이다. 교회 탑에 길 위에서 묻다라는 문구가 방문객들에게 많은 질문을 던진다. 종교에 상관없이 길 위에서 이곳을 지나는 모든 사람들에게 열린 공간으로 홀로 조용히 지나온 길들을 돌아볼 기회를 선사해 준다. 넓은 한경면 일대 전원 풍경에 자그마한 교회의 이국적인 모습이 조화를 이룬다. 입장료도, 운영시간도 따로 없어 부담 없이 지나가다 둘러보기 좋다.",4,,,순례자의 교회,63009,Type1,20211209000837,http://tong.visitkorea.or.kr/cms/resource/52/3585352_image2_1.jpg,http://tong.visitkorea.or.kr/cms/resource/52/3585352_image3_1.jpg,50,110,HS,HS03,HS030200,126.1805486613,33.3198309570,6,20251217140140,4,,63009,,,,,,,,,,,,,,,,,,,,,,,,,,,success,2026-07-13T03:35:30.867420+00:00,,,0,0,0,070-7569-0460,,,,,,,가능,,,,,,,,,,,,,연중무휴,,,,,,,,,,,,,,,,상시 개방,,
